{
  "updated_at": "2026-03-11 15:57",
  "update_frequency": "Borsa saatleri içerisinde her saat başı otomatik güncellenir",
  "bist30": {
    "index_value": 15023.45,
    "change_percent": 0.26,
    "volume": 0,
    "high": 15089.47,
    "low": 14819.89,
    "date": "2026-03-11"
  },
  "indices": {
    "XU030": {
      "name": "BIST 30",
      "ticker": "XU030.IS",
      "value": 15023.45,
      "change": 38.25,
      "change_pct": 0.26,
      "weekly_change_pct": 0.84,
      "monthly_change_pct": 0.06,
      "yearly_high": 16014.0,
      "yearly_low": 9733.6,
      "volume": 0,
      "sma20": 15278.85,
      "sma50": 14549.62,
      "sma200": 12411.67,
      "trend": "YÜKSELEN",
      "trend_color": "#69f0ae",
      "yorum": "BIST 30 yükseliş eğiliminde. Orta vadeli ortalama olan SMA50'nin üzerinde seyrediyor. Kısa vadeli çekilmeler alım fırsatı olabilir.",
      "gunluk_yorum": "Bugün piyasa yatay seyrediyor. Net bir yön belli değil, hacim düşük."
    },
    "XU100": {
      "name": "BIST 100",
      "ticker": "XU100.IS",
      "value": 13200.38,
      "change": 24.68,
      "change_pct": 0.19,
      "weekly_change_pct": 0.93,
      "monthly_change_pct": -4.32,
      "yearly_high": 14532.7,
      "yearly_low": 8872.75,
      "volume": 0,
      "sma20": 13630.87,
      "sma50": 13179.31,
      "sma200": 11274.27,
      "trend": "YÜKSELEN",
      "trend_color": "#69f0ae",
      "yorum": "BIST 100 yükseliş eğiliminde. Orta vadeli ortalama olan SMA50'nin üzerinde seyrediyor. Kısa vadeli çekilmeler alım fırsatı olabilir.",
      "gunluk_yorum": "Bugün piyasa yatay seyrediyor. Net bir yön belli değil, hacim düşük."
    }
  },
  "top_buys": [
    {
      "ticker": "TKFEN",
      "name": "Tekfen Holding",
      "sector": "Holding",
      "price": 84.65,
      "change_pct": 5.1553,
      "rsi": 59.6353,
      "stoch_k": 94.3851,
      "adx": 32.3584,
      "volume_ratio": 1.4,
      "signal": "HAFİF AL",
      "signal_en": "WEAK_BUY",
      "score": 23.4,
      "confidence": 61.9,
      "color": "#69f0ae",
      "targets": {
        "target_1": 85.92,
        "target_2": 87.19,
        "target_3": 88.46,
        "stop_loss": 82.96,
        "add_level": 83.8
      },
      "explanation_short": "🟢 Günlük bazda ALIŞ sinyali veriyoruz. Alım sebepleri: GÜÇLÜ AL — MACD yukarı kesişim (Golden Cross). Yükseliş başlangıcı! | HAFİF AL — Genel trend yukarı yönlü. | HAFİF AL — Kısa vadeli toparlanma me"
    },
    {
      "ticker": "ASELS",
      "name": "Aselsan",
      "sector": "Savunma",
      "price": 335.75,
      "change_pct": 0.4488,
      "rsi": 59.1128,
      "stoch_k": 69.1892,
      "adx": 45.5157,
      "volume_ratio": 0.4,
      "signal": "HAFİF AL",
      "signal_en": "WEAK_BUY",
      "score": 23.2,
      "confidence": 64.4,
      "color": "#69f0ae",
      "targets": {
        "target_1": 340.79,
        "target_2": 345.82,
        "target_3": 350.86,
        "stop_loss": 329.03,
        "add_level": 332.39
      },
      "explanation_short": "🟢 Günlük bazda ALIŞ sinyali veriyoruz. Alım sebepleri: HAFİF AL — Yükseliş trendi sürüyor ama momentum azalıyor. | AL — Tüm ortalamalar altında, mükemmel teknik görünüm. | AL — Altın kesişim aktif. Uz"
    },
    {
      "ticker": "TUPRS",
      "name": "Tüpraş",
      "sector": "Enerji",
      "price": 248.3,
      "change_pct": 0.121,
      "rsi": 63.3242,
      "stoch_k": 55.2896,
      "adx": 30.5908,
      "volume_ratio": 1.2,
      "signal": "HAFİF AL",
      "signal_en": "WEAK_BUY",
      "score": 18.7,
      "confidence": 46.2,
      "color": "#69f0ae",
      "targets": {
        "target_1": 252.02,
        "target_2": 255.75,
        "target_3": 259.47,
        "stop_loss": 243.33,
        "add_level": 245.82
      },
      "explanation_short": "🟡 Günlük bazda BEKLEME sinyali veriyoruz. Göstergeler karışık sinyal üretiyor. \n\n📊 DESTEK & DİRENÇ SEVİYELERİ:\n  • Direnç 3: ₺384.42\n  • Direnç 2: ₺330.83\n  • Direnç 1: ₺289.57\n  • Pivot: ₺235.98\n  • "
    }
  ],
  "top_sells": [
    {
      "ticker": "HEKTS",
      "name": "Hektaş",
      "sector": "Kimya",
      "price": 2.9,
      "change_pct": -1.6949,
      "rsi": 38.0194,
      "stoch_k": 21.3115,
      "adx": 34.8785,
      "volume_ratio": 0.4,
      "signal": "HAFİF SAT",
      "signal_en": "WEAK_SELL",
      "score": -20.9,
      "confidence": 54.6,
      "color": "#ff8a80",
      "targets": {
        "target_1": 2.86,
        "target_2": 2.81,
        "target_3": 2.77,
        "stop_loss": 2.96,
        "add_level": 2.93
      },
      "explanation_short": "🔴 Günlük bazda SATIŞ sinyali veriyoruz. Satış sebepleri: HAFİF SAT — Düşüş trendi var ama zayıflıyor. | SAT — Tüm ortalamalar üstünde, ağır düşüş trendi. | SAT — Ölüm kesişimi aktif. Uzun vadeli düşüş"
    },
    {
      "ticker": "PGSUS",
      "name": "Pegasus",
      "sector": "Havacılık",
      "price": 180.0,
      "change_pct": 0.3345,
      "rsi": 35.0211,
      "stoch_k": 30.9002,
      "adx": 28.5934,
      "volume_ratio": 0.4,
      "signal": "HAFİF SAT",
      "signal_en": "WEAK_SELL",
      "score": -20.9,
      "confidence": 54.6,
      "color": "#ff8a80",
      "targets": {
        "target_1": 177.3,
        "target_2": 174.6,
        "target_3": 171.9,
        "stop_loss": 183.6,
        "add_level": 181.8
      },
      "explanation_short": "🔴 Günlük bazda SATIŞ sinyali veriyoruz. Satış sebepleri: HAFİF SAT — Düşüş trendi var ama zayıflıyor. | SAT — Tüm ortalamalar üstünde, ağır düşüş trendi. | SAT — Ölüm kesişimi aktif. Uzun vadeli düşüş"
    },
    {
      "ticker": "TAVHL",
      "name": "TAV Havalimanları",
      "sector": "Havacılık",
      "price": 302.5,
      "change_pct": 0.5819,
      "rsi": 41.6888,
      "stoch_k": 41.9492,
      "adx": 58.3688,
      "volume_ratio": 0.7,
      "signal": "HAFİF SAT",
      "signal_en": "WEAK_SELL",
      "score": -16.4,
      "confidence": 66.1,
      "color": "#ff8a80",
      "targets": {
        "target_1": 297.96,
        "target_2": 293.43,
        "target_3": 288.89,
        "stop_loss": 308.55,
        "add_level": 305.52
      },
      "explanation_short": "🟡 Günlük bazda BEKLEME sinyali veriyoruz. Göstergeler karışık sinyal üretiyor. \n\n📊 DESTEK & DİRENÇ SEVİYELERİ:\n  • Direnç 3: ₺446.33\n  • Direnç 2: ₺407.67\n  • Direnç 1: ₺355.08\n  • Pivot: ₺316.42\n  • "
    },
    {
      "ticker": "SASA",
      "name": "SASA Polyester",
      "sector": "Kimya",
      "price": 2.2,
      "change_pct": -2.6549,
      "rsi": 35.7912,
      "stoch_k": 17.5,
      "adx": 38.8082,
      "volume_ratio": 4.1,
      "signal": "HAFİF SAT",
      "signal_en": "WEAK_SELL",
      "score": -15.1,
      "confidence": 26.5,
      "color": "#ff8a80",
      "targets": {
        "target_1": 2.17,
        "target_2": 2.13,
        "target_3": 2.1,
        "stop_loss": 2.24,
        "add_level": 2.22
      },
      "explanation_short": "🟡 Günlük bazda BEKLEME sinyali veriyoruz. Göstergeler karışık sinyal üretiyor. \n\n📊 DESTEK & DİRENÇ SEVİYELERİ:\n  • Direnç 3: ₺3.54\n  • Direnç 2: ₺3.25\n  • Direnç 1: ₺2.72\n  • Pivot: ₺2.43\n  • Destek 1"
    },
    {
      "ticker": "TOASO",
      "name": "Tofaş",
      "sector": "Otomotiv",
      "price": 304.5,
      "change_pct": 0.0822,
      "rsi": 46.938,
      "stoch_k": 43.9834,
      "adx": 32.302,
      "volume_ratio": 0.7,
      "signal": "HAFİF SAT",
      "signal_en": "WEAK_SELL",
      "score": -14.6,
      "confidence": 47.7,
      "color": "#ff8a80",
      "targets": {
        "target_1": 299.93,
        "target_2": 295.37,
        "target_3": 290.8,
        "stop_loss": 310.59,
        "add_level": 307.55
      },
      "explanation_short": "🟡 Günlük bazda BEKLEME sinyali veriyoruz. Göstergeler karışık sinyal üretiyor. \n\n📊 DESTEK & DİRENÇ SEVİYELERİ:\n  • Direnç 3: ₺463.90\n  • Direnç 2: ₺406.70\n  • Direnç 1: ₺355.60\n  • Pivot: ₺298.40\n  • "
    }
  ],
  "signal_counts": {
    "STRONG_BUY": 0,
    "BUY": 0,
    "WEAK_BUY": 3,
    "HOLD": 13,
    "WEAK_SELL": 12,
    "SELL": 0,
    "STRONG_SELL": 0
  },
  "news": [
    {
      "title": "📊 BIST 30 Teknik Analiz Raporu Güncellendi",
      "summary": "Tüm BIST 30 hisseleri için güncel teknik analiz raporu hazırlandı. 11.03.2026 15:57 itibarıyla 9 farklı gösterge ile analiz yapıldı.",
      "date": "11.03.2026 15:57",
      "category": "analiz",
      "icon": "📊"
    },
    {
      "title": "🔔 Stochastic & ADX Göstergeleri Eklendi",
      "summary": "Yeni teknik göstergeler: Stochastic Oscillator ve ADX (Average Directional Index) artık tüm hisseler için hesaplanıyor. Fibonacci düzeltme seviyeleri de aktif.",
      "date": "11.03.2026 15:57",
      "category": "güncelleme",
      "icon": "🔔"
    },
    {
      "title": "🎯 Hedef Fiyat Sistemi Aktif",
      "summary": "Her hisse için günlük, haftalık ve aylık hedef fiyatlar, stop-loss seviyeleri ve ekleme noktaları hesaplanıyor.",
      "date": "11.03.2026 15:57",
      "category": "özellik",
      "icon": "🎯"
    },
    {
      "title": "⏰ Veriler Borsa Saatlerinde Saatlik Güncelleniyor",
      "summary": "Piyasa açıkken (10:00 - 18:30) veriler her saat başı otomatik güncellenir. Son güncelleme saatini sayfanın üstünde görebilirsiniz.",
      "date": "11.03.2026",
      "category": "bilgi",
      "icon": "⏰"
    }
  ]
}